{
  "schemaVersion": 2,
  "packageId": "JYPPX.HipSharp.Runtime.win-x64",
  "packageVersion": "7.2.0",
  "rid": "win-x64",
  "nativeAssetPath": "runtimes/win-x64/native",
  "packEnabled": false,
  "verified": false,
  "source": {
    "status": "local-inventory-unavailable",
    "sdkVersion": "7.2.0",
    "architecture": "x64",
    "officialFileNames": {
      "runtime": "amdhip64_7.dll",
      "rtc": "hiprtc0702.dll"
    },
    "officialDocumentation": [
      "https://rocm.docs.amd.com/projects/install-on-windows/en/latest/reference/system-requirements.html",
      "https://rocm.docs.amd.com/projects/install-on-windows/en/latest/install/install-hip.html",
      "https://rocm.docs.amd.com/projects/install-on-windows/en/latest/how-to/hip-app-deployment.html"
    ],
    "buildMetadata": [
      "https://github.com/ROCm/clr/blob/rocm-7.2.1/hipamd/src/CMakeLists.txt",
      "https://github.com/ROCm/clr/blob/rocm-7.2.1/hipamd/src/hiprtc/CMakeLists.txt"
    ],
    "auditPolicy": {
      "requiresAuthenticode": true,
      "requiredSigner": "Advanced Micro Devices",
      "maximumNativePayloadBytes": 500000000,
      "nativePayload": "DLL files only under runtimes/win-x64/native"
    },
    "acquisitionPolicy": "Inventory an installed official AMD HIP SDK; do not redistribute the driver-provided runtime or download an unverified DLL archive.",
    "reason": "No AMD HIP SDK installation is present on the M6 Windows workstation, so file hashes, import closure, licenses, and GPU execution cannot be asserted."
  },
  "packages": [
    {
      "name": "AMD HIP SDK for Windows",
      "version": "7.2.0",
      "architecture": "x64",
      "url": "https://rocm.docs.amd.com/projects/install-on-windows/en/latest/install/install-hip.html",
      "sha256": null,
      "size": null,
      "status": "not-inventoried"
    }
  ],
  "files": [],
  "licenses": [],
  "dependencyClosure": {
    "rootPackages": [],
    "rocmPayloadPackages": [],
    "metadataOnlyPackages": [],
    "decision": "Static skeleton only. Closure inventory is required before packaging can be enabled."
  },
  "systemDependencies": [],
  "driverBoundary": {
    "deviceNodes": [],
    "kernelDriver": [],
    "excludedFromPackage": [
      "kernel driver",
      "firmware"
    ]
  },
  "sbom": {
    "format": "CycloneDX-1.5",
    "path": "win-x64.cdx.json",
    "sha256": null
  },
  "verification": {
    "provenanceVerified": false,
    "closureVerified": false,
    "licensesVerified": false,
    "sbomVerified": false,
    "packageAuditVerified": false,
    "gpuValidated": false,
    "validationSha256": null,
    "environment": null,
    "reason": "M6 static skeleton is present, but local SDK inventory and Windows GPU validation are unavailable."
  }
}
